{
  "$schema": "./tokens.schema.json",
  "meta": {
    "project": "TShirtSwiss Elementor Free rebuild",
    "status": "reference-extraction-pending",
    "source": "Production screenshots and computed styles",
    "intentionalDifferences": [
      "Do not reproduce the thin red homepage announcement strip."
    ]
  },
  "colors": {
    "brandPrimary": null,
    "brandSecondary": null,
    "accent": null,
    "textPrimary": null,
    "textSecondary": null,
    "surface": null,
    "surfaceAlternate": null,
    "border": null,
    "success": null,
    "warning": null,
    "error": null
  },
  "typography": {
    "fontFamilies": {
      "heading": null,
      "body": null
    },
    "fontWeights": {
      "regular": 400,
      "medium": 500,
      "semibold": 600,
      "bold": 700
    },
    "styles": {
      "display": null,
      "h1": null,
      "h2": null,
      "h3": null,
      "h4": null,
      "bodyLarge": null,
      "body": null,
      "bodySmall": null,
      "button": null,
      "caption": null
    }
  },
  "layout": {
    "contentWidth": null,
    "wideWidth": null,
    "pageGutter": {
      "desktop": null,
      "tablet": null,
      "mobile": null
    },
    "sectionSpacing": {
      "desktop": null,
      "tablet": null,
      "mobile": null
    }
  },
  "spacing": {
    "xs": null,
    "sm": null,
    "md": null,
    "lg": null,
    "xl": null,
    "2xl": null,
    "3xl": null
  },
  "radii": {
    "small": null,
    "medium": null,
    "large": null,
    "pill": 999
  },
  "shadows": {
    "small": null,
    "medium": null,
    "large": null
  },
  "buttons": {
    "primary": null,
    "secondary": null,
    "text": null
  },
  "breakpoints": {
    "desktopReference": 1440,
    "tabletReference": 768,
    "mobileReference": 390,
    "elementorTabletMax": 1024,
    "elementorMobileMax": 767
  }
}
